url,title,authors,weekday,tags,total_episodes,likes,synopsis,thumbnail_url,error
https://comic.naver.com/webtoon/list?titleId=131385,쿠베라,카레곰,목,"판타지, 절망적인, 신화, 마법, 크리처, 로맨스, 세계관, 인외존재, 복수극, 다크판타지",710,482366,"신의 이름을 가진 소녀 쿠베라 리즈. 15세 생일에 외출에서 돌아오다가 초토화되어버린 마을을 목격하게 되는데..! 신, 수라, 마법사들 사이에서 펼쳐지는 소속불명 장르 혼합 판타지.",https://shared-comic.pstatic.net/thumb/webtoon/131385/thumbnail/thumbnail_IMAG21_1d44dd99-4fef-48b5-81f0-083e83b6c048.jpg,
https://comic.naver.com/webtoon/list?titleId=21815,히어로메이커,빤쓰,월,"판타지, 판타지개그, 서양, 모험, 전쟁, 정치, 용사, 왕족/귀족, 개그, 성장물",989,81757,왕은 영웅이 되고 싶어하는 공주의 소원을 들어주기로 전격 결심! 공주를 속이고 마치 영웅이 된 것처럼 만들기 위해 온 나라가 연극을 하게 되는데..파란만장한 그들만의 눈물겨운 영웅만들기의 대장정이 펼쳐집니다~,https://shared-comic.pstatic.net/thumb/webtoon/21815/thumbnail/thumbnail_IMAG21_7292511306663934265.jpg,
https://comic.naver.com/webtoon/list?titleId=400739,에이머,구동인,화,"판타지, 현대, 이능력, 배틀, 전쟁, 크리처, 개그, sf, 이능력배틀물, 인외존재, 두뇌싸움",552,148516,"작은 우연은 역사를 만든다.
지구를 침공한 이성인 팜킨 일당과, 그들을 막아선 초월자 에이머와 지구인의 이야기!",https://shared-comic.pstatic.net/thumb/webtoon/400739/thumbnail/thumbnail_IMAG21_b5046846-5af7-48a9-9b20-b0b07cf0c904.jpeg,
https://comic.naver.com/webtoon/list?titleId=570506,최강전설 강해효,최병열,목,"액션, 학원액션, 소년물, 참교육, 성장물, 격투기, 학원물, 복수극, 먼치킨",625,593861,"맹수같이 거친 문제아 학생들만 모여있는 최강고등학교!!

그곳에서 변화가 시작되었다.",https://shared-comic.pstatic.net/thumb/webtoon/570506/thumbnail/thumbnail_IMAG21_3630857206429464627.jpg,
https://comic.naver.com/webtoon/list?titleId=602916,"칼부림
휴재",고일권,수,"무협/사극, 시리어스, 과거, 동양, 시대물, 전쟁, 정치, 액션, 성장물, 역사물, 판무, 복수극",473,77154,"뜻을 품고 한을 품은 팔도의 자제들아 서슬퍼런 칼날 내보이라!
이괄의 난을 배경으로 펼쳐지는 함이의 복수와 성장",https://shared-comic.pstatic.net/thumb/webtoon/602916/thumbnail/thumbnail_IMAG21_43cf1d1e-d265-464d-83db-f92dbc3fcf43.jpg,
https://comic.naver.com/webtoon/list?titleId=616239,윌유메리미,마인드C,월,"일상, 공감, 결혼생활, 가족, 연애/결혼공감, 가벼운, 개그, 무해한, 러블리, 힐링",1179,328834,"외모는 상남자, 마음은 감성소녀 윌.외모는 청순녀, 마음은 터프가이 메리!
서울 부산 띠동갑 커플의 리얼 연애 일기",https://shared-comic.pstatic.net/thumb/webtoon/616239/thumbnail/thumbnail_IMAG21_b412e69f-b6dc-40eb-b022-0f2c0991389b.jpg,
https://comic.naver.com/webtoon/list?titleId=641253,외모지상주의,박태준,금,"드라마, 사이다, 학원액션, 소년물, 참교육, 성장물, 격투기, 학원물, 인플루언서, 복수극, 먼치킨",569,2440838,"못생기고 뚱뚱하다고 괴롭힘을 당하며  루저 인생만 살아온 내가 잘생겨졌다는 이유로 인싸가 됐다.

어느 날 자고 일어났더니 갑자기 완벽한 외모와 몸을 지닌 사람이 되어 깨어난다면?",https://shared-comic.pstatic.net/thumb/webtoon/641253/thumbnail/thumbnail_IMAG21_01672165-03c8-44b1-ba0e-ef82c9cfcd10.jpg,
https://comic.naver.com/webtoon/list?titleId=642598,조선왕조실톡,무적핑크,월,개그,428,459986,"어느 날 메신저로 찾아온, 조선 시대 그분들의 시시콜콜한 이야기.",https://shared-comic.pstatic.net/thumb/webtoon/642598/thumbnail/thumbnail_IMAG21_c784c8b0-c6d3-46ca-9a02-d3c4c04a8c83.jpg,
https://comic.naver.com/webtoon/list?titleId=644112,몽홀,장태산,금,"무협/사극, 역사판타지, 시리어스, 절망적인, 과거, 소년물, 모험, 전쟁, 정치, 역사물, 세계관",516,95491,"차갑고 척박한 땅 몽홀
그 곳에서 펼쳐지는 감동의 대서사시",https://shared-comic.pstatic.net/thumb/webtoon/644112/thumbnail/thumbnail_IMAG21_3618981192359294768.jpg,
https://comic.naver.com/webtoon/list?titleId=64997,나이트런,김성민,토,"판타지, 절망적인, 전쟁, 정치, 크리처, 세계관, 아포칼립스, sf, 먼치킨, 다크판타지",772,253430,"우주력 430년. 성간이동이 가능해져 별과 별을 이동하는 시대
인간은 괴수와 싸우고 있다. 기사와 함께.광활한 우주를 배경으로 판타지 SF가 다가온다.",https://shared-comic.pstatic.net/thumb/webtoon/64997/thumbnail/thumbnail_IMAG21_3834645974328108595.jpg,
https://comic.naver.com/webtoon/list?titleId=650305,호랑이형님,이상규,토,"판타지, 명작, 세계관, 동양풍판타지, 판무, 동물",429,912325,"신비한 힘을 가진 아이를 이용하여 세상을 지배하려는 반인반수 흰눈썹!

그리고 얼떨결에 아이의 보호자가 된 괴물호랑이 빠르와 착호갑사 지망생 가우리!
이제 힘을 합쳐 흰눈썹으로부터 아이와 세상을 지켜라!!!",https://shared-comic.pstatic.net/thumb/webtoon/650305/thumbnail/thumbnail_IMAG21_9e070729-5990-4653-90dd-1158847c1c68.jpg,
https://comic.naver.com/webtoon/list?titleId=654138,은주의 방 2~3부,노란구미,화,"드라마, 리얼로맨스, 공감, 첫사랑, 짝사랑남, 능력남, 명랑녀, 일상, 드라마&영화 원작웹툰, 친구>연인",478,155886,"인테리어, 그것은 삶을 바꿔주는 마법이다!
반복되는 야근과 업무 스트레스로 회사를 때려치운 뒤
셀프 인테리어로 인기 블로거가 된 은주.
그녀의 인테리어에서 연애까지, 라이프 체인지 스토리.",https://shared-comic.pstatic.net/thumb/webtoon/654138/thumbnail/thumbnail_IMAG21_3559587746721839161.jpg,
https://comic.naver.com/webtoon/list?titleId=654774,소녀의 세계,모랑지,월,"드라마, 설렘폭발, 공감, 우정, 청춘, 외유내강녀, 명랑녀, 햇살녀, 햇살캐, 힐링, 하이틴, 학원로맨스, 직진남, 청춘로맨스, 삼각관계, 까칠남, 감성드라마",475,1125471,"완벽해 보이지만 사실 외로웠던 백조들과 맘씨 착한 오리가 만나
여러 갈등을 함께 겪으며 진짜 친구가 되어가는 소녀들의 찐 우정물",https://shared-comic.pstatic.net/thumb/webtoon/654774/thumbnail/thumbnail_IMAG21_1209b520-bcd9-4031-b76f-bc8a7f5527fd.jpg,
https://comic.naver.com/webtoon/list?titleId=671421,언덕 위의 제임스,쿠당탕,수,"개그, 열혈병맛개그, 블랙코미디, 옴니버스, 병맛, 가벼운",504,155925,"제임스들이 펼치는 코믹 막장 에피소드!
지금 전세계의 제임스들이 몰려온다",https://shared-comic.pstatic.net/thumb/webtoon/671421/thumbnail/thumbnail_IMAG21_7643171d-08fb-40a8-9da1-813a3b7e784f.jpg,
https://comic.naver.com/webtoon/list?titleId=698918,원주민 공포만화,원주민,화,"스릴러, 오컬트판타지, 병맛, 개그, 오컬트, 4차원, 서스펜스, 괴담",422,298719,"끝날 때까지 끝난 것이 아니다!
마지막까지 방심할 수 없는 다양한 에피소드.
당신의 상상을 뛰어넘는 본격 반전 공포 스릴러가 온다!",https://shared-comic.pstatic.net/thumb/webtoon/698918/thumbnail/thumbnail_IMAG21_3689346629442483042.jpg,
https://comic.naver.com/webtoon/list?titleId=703630,어글리후드,미애,토,"판타지, 이능력, 배틀, 우정, 가족, 세계관, 최강자전, 2017 최강자전, 힘숨찐, sf, 이능력배틀물, 사이비종교, 먼치킨, 걸크러시",338,309930,"외계인이 유일신으로 군림한 미친 세상,
바꾸고싶다면 사탄이 되어라",https://shared-comic.pstatic.net/thumb/webtoon/703630/thumbnail/thumbnail_IMAG21_5501365b-0934-4683-b4a8-cc76ef1ec585.jpg,
https://comic.naver.com/webtoon/list?titleId=703839,홍시는 날 좋아해!,"강하다, 웃는해",토,"로맨스, 설렘폭발, 캠퍼스, 청춘, 공식미남, 연하남, 연상녀, 평범녀, 철벽녀, 햇살캐, 학원로맨스, 청춘로맨스, 까칠남",336,354647,"스무 살 고3 홍시호가 전학 왔어요! 방긋방긋 웃는 모습 뒤에는 어떤 비밀이...?
단내 나는 홍시가 예쁘게 여물어가는 이야기.",https://shared-comic.pstatic.net/thumb/webtoon/703839/thumbnail/thumbnail_IMAG21_25d73f71-25e2-4328-8634-1062f796dc67.jpg,
https://comic.naver.com/webtoon/list?titleId=715206,ㅋㄷㅋㄷ만화,교교박,수,일상,51,42872,본 컨텐츠는 질병관리청의 브랜드 웹툰으로 교교박 작가가 전하는 에이즈 및 성매개감염병 예방 캠페인입니다.,https://shared-comic.pstatic.net/thumb/webtoon/715206/thumbnail/thumbnail_IMAG21_5c7a6b96-ec34-41d0-99f8-a8aeffc1ed42.jpg,
https://comic.naver.com/webtoon/list?titleId=717481,일렉시드,"손제호, 제나",수,"액션, 이능력, 배틀, 아카데미물, 세계관, 학원물, 이능력배틀물, 인외존재, 성장드라마, 동물, 먼치킨",364,578155,"<노블레스> 손제호 작가와 <소녀더와일즈> 제나 작가가 만났다!
고양이 몸에 깃든 각성자 카이든과 각성능력을 숨겨온 고등학생 지우
러블리 2인조의 액션 판타지",https://shared-comic.pstatic.net/thumb/webtoon/717481/thumbnail/thumbnail_IMAG21_3545800975505057126.jpg,
https://comic.naver.com/webtoon/list?titleId=721948,"스터디그룹
휴재","신형욱, 유승연",토,"액션, 블루스트링, 힘숨찐, 학원물",292,732592,"우등생을 꿈꾸는 최강 소년의 고교액션활극.
공부를 잘 하고 싶지만 애석하게도 싸움 실력에만 재능이 몰빵된 고등학생 윤가민.
똥통학교 유성공고에서 스터디그룹을 만드는데….
그와 스터디 멤버들의 (진짜로) 피튀기는 입시이야기!",https://shared-comic.pstatic.net/thumb/webtoon/721948/thumbnail/thumbnail_IMAG21_c03c888e-0610-4f6b-b834-422463871d2f.jpg,
https://comic.naver.com/webtoon/list?titleId=724815,아홉수 우리들,수박양,토,"로맨스, 리얼로맨스, 공감, 현대, 청춘, 능력남, 아방녀, 소심녀, 능력녀, 다정남, 하이퍼리얼리즘, 감성드라마",266,477402,"연애, 직장, 시험 어느 하나 뜻대로 되지 않는 29살 봉우리, 차우리, 김우리.
제대로 걸렸다! 아.홉.수!
우리들의 팩트폭행 로맨틱 코미디!",https://shared-comic.pstatic.net/thumb/webtoon/724815/thumbnail/thumbnail_IMAG21_08aa1511-f7aa-412a-bbcd-8f6504f0da76.jpg,
https://comic.naver.com/webtoon/list?titleId=725586,1초,"시니, 광운",금,"드라마, 눈물샘자극, 현대, 이능력, 청춘, 직업드라마, 서스펜스, 성장드라마",318,607632,"구조율 100%의 전설적인 소방관.
그의 특별한 능력은 긴장하는 순간, 미래가 보인다는 것!
촌각을 다투는 진짜 소방관들의 이야기",https://shared-comic.pstatic.net/thumb/webtoon/725586/thumbnail/thumbnail_IMAG21_aac005dc-11a7-41b6-a127-4ffa5b480698.jpg,
https://comic.naver.com/webtoon/list?titleId=729047,공유몽,"주신, 유령선",토,"판타지, 이능력, 배틀, 액션, 서바이벌, 세계관, 이능력배틀물, 먼치킨",270,185262,"잠이 들면 또 다른 세계가 펼쳐진다!
꿈을 빼앗긴 자들이 모이는 곳 ‘큐브’
고유한 능력과 아이템을 부여받은 ‘큐버’
존재하지 않았던 일곱 번째 형태의 아이템을 계승한 ‘도시언’의 성장 액션 먼치킨 판타지!",https://shared-comic.pstatic.net/thumb/webtoon/729047/thumbnail/thumbnail_IMAG21_3a569ac9-9ba9-448e-8438-eb2b8bdab961.jpg,
https://comic.naver.com/webtoon/list?titleId=729964,만물의 영장,보민,목,"개그, 판타지개그, 액션, 병맛, 4차원, 이능력배틀물, 인외존재, 소년왕도물, 동물, 먼치킨",264,117312,"바다에 빠져 실종된 후, 무인도에서 7년 만에 살아 돌아온 우영장의 좌충우돌 문명 적응기!
그의 몸은 단단한 근육질로 변했고 온갖 동물과의 의사소통은 물론, 특별한 능력까지 구사하며 사건사고가 끊이질 않는다.
과연 영장은 밀림보다 무섭다는 도시에서 살아남을 수 있을까?",https://shared-comic.pstatic.net/thumb/webtoon/729964/thumbnail/thumbnail_IMAG21_3625061d-dadd-4e0c-96cd-9fcf1fe584c9.jpg,
https://comic.naver.com/webtoon/list?titleId=730425,"판타지 여동생!
휴재",유누,수,"판타지, 액션판타지, 마법, 크리처, 가족, 가벼운, 던전물, 개그, 게임판타지",306,128221,"게임 초보 여동생의 RPG 도전기.
트롤 취급은 노노! 제가 사실 엄청난 히든 직업을 갖고 있거든요?",https://shared-comic.pstatic.net/thumb/webtoon/730425/thumbnail/thumbnail_IMAG21_3835209134721021750.jpg,
https://comic.naver.com/webtoon/list?titleId=730656,사신소년,류,화,"액션, 액션판타지, 학원액션, 현대, 동양, 소년물, 판타지, 이능력배틀물, 소년왕도물, 먼치킨, 다크판타지",293,673770,"수명을 대가로 죽은 자의 능력을 빌리는 소년!
화려한 액션에서 부터 스포츠, 두뇌 플레이까지 한계는 없다!",https://shared-comic.pstatic.net/thumb/webtoon/730656/thumbnail/thumbnail_IMAG21_fc6d8dbf-eed2-43d0-af45-2edb3cc4244e.jpg,
https://comic.naver.com/webtoon/list?titleId=730694,초인의 시대,섭이,토,"액션, 액션판타지, 현대, 소년물, 판타지, 최강자전, 2018 최강자전, 이능력배틀물, 소년왕도물, 먼치킨",203,554589,"지구에 근원 모를 괴물들이 출현하고
그들을 제압하는 '초인'들 또한 등장한다.
정체불명의 괴물과 초인, 바야흐로 '초인의 시대'가 도래한다!",https://shared-comic.pstatic.net/thumb/webtoon/730694/thumbnail/thumbnail_IMAG21_29c75eb5-39f4-4608-8c79-737bc8330bb0.jpg,
https://comic.naver.com/webtoon/list?titleId=733074,백수세끼,치즈,월,"드라마, 리얼로맨스, 공감, 캠퍼스, 오피스, 평범남, 평범녀, 재회, 음식&요리, 감성드라마",244,504181,"백수 시절 내 곁을 지켜줬던 그녀... 돌아와 주면 안 되겠니?
음식 메뉴마다 담겨 있는 우리들의 연애 흑역사!",https://shared-comic.pstatic.net/thumb/webtoon/733074/thumbnail/thumbnail_IMAG21_80df3e76-47af-4007-b57c-e8f2830835e5.jpg,
https://comic.naver.com/webtoon/list?titleId=733280,나를 바꿔줘,"이지호, 호띠",토,"드라마, 고자극드라마, 자극적인, 사회고발, 악역이주인공, 빌런, 판타지, 참교육, 피카레스크, 복수극, 걸크러시",312,316735,"수상한 생명보험에 드는 조건으로, 하루 아침에 내가 원하는 외모로 살 수 있게 된다면?
인생을 바꾸기 위해 얼굴을 훔치다!",https://shared-comic.pstatic.net/thumb/webtoon/733280/thumbnail/thumbnail_IMAG21_d0cac92e-cbe4-42ef-aec0-a81ecffb26ef.jpg,
https://comic.naver.com/webtoon/list?titleId=734574,"영앤리치가 아니야!
휴재",최삡뺩,월,"개그, 할리퀸, 청춘, 짝사랑남, 능력남, 재벌남, 소심녀, 순진녀, 다정녀, 병맛, 재벌, 다정남, 하이틴, 학원로맨스, 학원물, 직진남, 청춘로맨스",140,52941,"<공대생 너무만화> 최삡뺩 작가의 개그로맨스 신작!
모든 게 완벽한 퍼렁식품 CEO의 아들 서민준.
어른들과 친구들에게는 인기 폭발이지만, 여자친구를 사귀어 본 적 없는 모태솔로다.
민준은 같은 학교 여학생 새영에게 반하게 되는데, 새영의 이상형은 흙수저이지만 노력하는 사람이고, 자기보다 잘난 남자를 매우 싫어한다고?
사랑을 얻기 위해 영앤리치를 숨겨야하는 민준이의 첫 연애 도전기!",https://shared-comic.pstatic.net/thumb/webtoon/734574/thumbnail/thumbnail_IMAG21_8688bbf6-1067-465b-9070-4fef7c1ab1cd.jpg,
https://comic.naver.com/webtoon/list?titleId=735661,재혼 황후,"히어리, 숨풀, 알파타르트",금,"로맨스, 사연녀, 다정남, 후회물, 궁중로맨스, 혐관로맨스, 직진남, 이세계, 역하렘, 연상연하, 삼각관계, 선결혼후연애, 로판, 걸크러시, 소설원작",232,975619,"동대제국의 완벽한 황후였던 나비에.
​황제인 남편이 정부를 황후로 만들려는 것을 알고 이혼을 택한다. 그리고 결심한다.
이곳에서 황후가 될 수 없다면 다른 곳에서 황후가 되겠다고.
인기 웹소설 '재혼 황후'가 웹툰화되다!",https://shared-comic.pstatic.net/thumb/webtoon/735661/thumbnail/thumbnail_IMAG21_2e35b4aa-4459-42fd-84a8-eae732910422.jpg,
https://comic.naver.com/webtoon/list?titleId=742105,미래의 골동품 가게,구아진,수,"스릴러, 오컬트판타지, 시리어스, 현대, 동양, 신화, 크리처, 오컬트, 동양풍판타지, 서스펜스, 괴담",227,343471,"남해의 먼 섬에 살고 있는 소녀, '미래'.
미래의 부모님이 바다에서 돌아오지 못한 그날부터, 모든 것들이 변하기 시작했다.
저주를 풀기 위한 단 한 가지의 방법.
소중한 것들을 지키기 위한 기묘한 소녀의 퇴마가 시작된다.",https://shared-comic.pstatic.net/thumb/webtoon/742105/thumbnail/thumbnail_IMAG21_a3860cc1-f927-4031-92fd-8d89b9801127.jpg,
https://comic.naver.com/webtoon/list?titleId=743139,한림체육관,"혜성, 이석재",화,"액션, 학원액션, 열혈, 소년물, 격투기, 블루스트링, 슈퍼스트링, 학원물, 소년왕도물",243,397906,"'세상에서 가장 강한 남자가 되고 싶다.'
그릇된 강함을 실천하던 전영하가 한림체육관에 들어와 진정한 강함을 깨닫고 무도인으로 거듭나는 학원 액션물",https://shared-comic.pstatic.net/thumb/webtoon/743139/thumbnail/thumbnail_IMAG21_0a0e585b-979a-4f1d-9cec-97d0abf5ef3d.jpg,
https://comic.naver.com/webtoon/list?titleId=745876,"플레이어
휴재","박종석, 오현준",금,"액션, 액션판타지, 소년물, 판타지, 가벼운, 게임판타지, 힘숨찐, 하이틴, 이능력배틀물, 빙의, 먼치킨",246,237943,베댓 공약으로 어쩌다 웹툰 속 주인공이 되었다!,https://shared-comic.pstatic.net/thumb/webtoon/745876/thumbnail/thumbnail_IMAG21_9947babf-41e3-4bd3-b7a8-86fa47efa4b9.jpg,
https://comic.naver.com/webtoon/list?titleId=746857,무사만리행,"운, 배민기",목,"무협/사극, 성장물, 퓨전사극, 판무, 먼치킨",242,251394,"콤모두스 황제와의 혈투 후 3년, 나루는 다시 한번 모든 것을 잃었다.",https://shared-comic.pstatic.net/thumb/webtoon/746857/thumbnail/thumbnail_IMAG21_9a0d4005-34a6-4fb5-a9dc-61a305cb580d.jpg,
https://comic.naver.com/webtoon/list?titleId=747269,전지적 독자 시점,"UMI, 슬리피-C, 싱숑",수,"판타지, 레드아이스 스튜디오, 게임, 세계관, 아포칼립스, 게임판타지, 헌터물, 이능력배틀물, 먼치킨, 구원서사, 소설원작",277,1336788,"'이건 내가 아는 그 전개다'
한순간에 세계가 멸망하고, 새로운 세상이 펼쳐졌다.
오직 나만이 완주했던 소설 세계에서 평범했던 독자의 새로운 삶이 시작된다.",https://shared-comic.pstatic.net/thumb/webtoon/747269/thumbnail/thumbnail_IMAG21_aabd9952-ff45-47a2-a543-33f19a5c6708.jpg,
https://comic.naver.com/webtoon/list?titleId=747271,나노마신,"현절무, 금강불괴, 한중월야",목,"무협/사극, 레드아이스 스튜디오, 사이다, 게임, 상태창, 참교육, sf, 판무, 이능력배틀물, 먼치킨, 소설원작",274,705733,"갖은 멸시와 목숨의 위협을 받던 마교의 사생아 천여운,
미래에서 나타난 후손이 천여운의 몸에 나노 머신을 주입한 후 그의 인생이 송두리째 바뀐다.
마교를 넘어 무림 최고의 자리에 오르기 위한 천여운의 거침없는 이야기가 시작된다!",https://shared-comic.pstatic.net/thumb/webtoon/747271/thumbnail/thumbnail_IMAG21_d46b4a69-6de0-41be-b368-ce5e74ab8f76.jpg,
https://comic.naver.com/webtoon/list?titleId=750184,나쁜사람,둠스,수,"액션, 사이다, 학원액션, 참교육, 가벼운, 개그, 격투기, 학원로맨스, 학원물, 느와르",267,420369,"착한 남자가 좋다는 그녀의 이상형이 되기 위해 10년 동안 노력했다.
그런데! 갑자기 나쁜 남자가 좋다는 그녀...

오늘부터 난... 나쁜 남자로 다시 태어난다.",https://shared-comic.pstatic.net/thumb/webtoon/750184/thumbnail/thumbnail_IMAG21_adfbd65f-18fa-4268-81db-ec88ae4aa8b1.jpg,
https://comic.naver.com/webtoon/list?titleId=750826,빌드업,911,수,"스포츠, 2019 지상최대공모전, 축구, 소년왕도물, 스포츠성장",197,315455,"축구덕후지만 볼보이만 5년째?!
빵셔틀 강마루의 열혈청춘 축구드라마",https://shared-comic.pstatic.net/thumb/webtoon/750826/thumbnail/thumbnail_IMAG21_d7a15cf7-bee5-4fa9-93be-19a2d0d3d6f3.jpg,
https://comic.naver.com/webtoon/list?titleId=751168,상남자,"하늘소, 도가도, 김태궁",금,"드라마, 사이다, 오피스, 청춘, 능력남, 인생역전, 직업드라마, 회귀, 두뇌싸움, 머니게임, 먼치킨, 소설원작",226,340782,"오로지 성공만을 바라보며 기업 정점의 자리까지 오른, 최고의 샐러리맨 한유현.
대가로 사랑하던 모든 이를 잃어버린 후, 후회 섞인 인생을 돌아보는데...
어느 날 모든 기억을 안은 채, 젊은 시절의 그때로 돌아가게 된다.
모든 것의 시작점인 신입사원의 위치에서, 그가 다시 삶을 설계한다!",https://shared-comic.pstatic.net/thumb/webtoon/751168/thumbnail/thumbnail_IMAG21_db791b21-1a43-4a47-bfe4-09f504e0c246.jpg,
https://comic.naver.com/webtoon/list?titleId=751999,백년게임,"하람, 지야",금,"판타지, 미래, 신화, 게임, 배틀, 성장물, 서바이벌, 세계관, 게임판타지, 이능력배틀물, 소년왕도물",273,77530,"""당신의 게임은 여기까지군요""
백 년마다 열리는 소원 그 이상을 이뤄주는 대회, 최종 우승자는 단 한 명.
소년 한시준, 가족을 구하기 위해 모든 것을 걸고 치열한 전투에 뛰어든다.",https://shared-comic.pstatic.net/thumb/webtoon/751999/thumbnail/thumbnail_IMAG21_d81aab3c-277e-4946-866d-ebb38fa246b6.jpg,
https://comic.naver.com/webtoon/list?titleId=752532,연우의 순정,이솔,화,"감성, 청춘, 햇살남, 소심남, 순정남, 다정녀, 무심녀, 능력녀, 사연녀, 성장물, 햇살캐, 러블리, 다정남, 짝사랑, 힐링, 학원물, 학원로맨스, 청춘로맨스, 걸크러시",206,277287,"여학생으로 오해받을 정도로 여리여리한 외모를 가진 연우.
그는 교내 인기스타인 강해솔을 몰래 좋아하고 있다.
하지만 낯을 굉장히 많이 가리고 소심한 연우는 같은 반인 해솔이에게 말 한 번 붙여본 적 없는데…",https://shared-comic.pstatic.net/thumb/webtoon/752532/thumbnail/thumbnail_IMAG21_e3431864-4c11-4137-993d-c06231521abb.jpg,
https://comic.naver.com/webtoon/list?titleId=753842,데빌샷,CTK,일,"판타지, 현대, 서바이벌, 오컬트, 헌터물, 이능력배틀물, 인외존재, 다크히어로, 동물, 걸크러시, 다크판타지",203,137939,"죽음을 마주한 순간,
지하세계의 왕과 계약했다.",https://shared-comic.pstatic.net/thumb/webtoon/753842/thumbnail/thumbnail_IMAG21_e0200ba5-29d5-42cf-8ba1-96ce053721fc.jpg,
https://comic.naver.com/webtoon/list?titleId=754876,카루나,강호진,목,"판타지, 액션판타지, 신화, 배틀, 마법, 소년물, 모험, 성장물, 인외존재, 소년왕도물",251,19036,"지옥의 군대와 맞서는 항마승병 카루나.
카루나에 도전하는 소년액션 모험 판타지!",https://shared-comic.pstatic.net/thumb/webtoon/754876/thumbnail/thumbnail_IMAG21_3904682673849053541.jpg,
https://comic.naver.com/webtoon/list?titleId=756140,라서드,감람,월,판타지,169,110073,"절대적 권능을 지닌 11인의 왕과, 왕을 수호하기 위한 기사단이 존재하는 세계.
수습기사 힌타는 파트너 캐넛과 함께 정식 기사가 되기 위한 모험을 떠나는데...
정식기사가 되기 위한 소년들의 고군분투 정통판타지액션!",https://shared-comic.pstatic.net/thumb/webtoon/756140/thumbnail/thumbnail_IMAG21_50527917-4994-43dd-a584-8dfbe29094d2.jpg,
https://comic.naver.com/webtoon/list?titleId=758037,참교육,"채용택, 한가람",월,"액션, 사이다, 학원액션, 자극적인, 사회고발, 참교육, 블루스트링, 학원물, 다크히어로, 먼치킨",209,962399,"무너진 교권을 지키기 위해 교권보호국 소속 나화진의 참교육이 시작된다!
<부활남> 채용택 작가 X <신석기녀> 한가람 작가의 신작!",https://shared-comic.pstatic.net/thumb/webtoon/758037/thumbnail/thumbnail_IMAG21_15cb2611-34c0-4f02-a689-41d0b1016579.jpg,
https://comic.naver.com/webtoon/list?titleId=758150,입학용병,"YC, 락현",일,"액션, 사이다, 학원액션, 우정, 가족, 참교육, 밀리터리, 학원물, 먼치킨, 느와르",253,726636,"어린 시절 비행기 추락 사고의 유일한 생존자 유이진.
살아남기 위해 용병으로 살아가던 유이진은 10년 후, 가족이 있는 고향으로 돌아왔다.",https://shared-comic.pstatic.net/thumb/webtoon/758150/thumbnail/thumbnail_IMAG21_4135492154714961716.jpg,
