url,title,authors,weekday,tags,total_episodes,likes,synopsis,thumbnail_url,error
https://comic.naver.com/webtoon/list?titleId=835910,고대동물기,고제형,일,"드라마, 감성적인, 옴니버스, 무해한, 힐링, 육아물, 인외존재, 동물, 감성드라마",32,109787,"모든 생명은 무엇을 위해 살아가고, 무엇을 위해 죽어갈까?
세상으로부터 버려진 채 늙어 죽어가는 티라노사우루스 한 마리. 그런 그에게 죽기 전에 이뤄야 할 꿈이 생겼다.
이 땅에 살고, 이 땅에 죽어간 생명들의 기묘하고도 특별한 이야기",https://shared-comic.pstatic.net/thumb/webtoon/835910/thumbnail/thumbnail_IMAG21_91ef0b26-d478-4810-8106-d257e6cba6b8.jpg,
https://comic.naver.com/webtoon/list?titleId=835925,짐승같은 것들,김태희,목,"로맨스, 혐관, 유혹남, 고자극로맨스, 세계관, 혐관로맨스, 직진남",34,64434,"'딴 놈들에게 절대 뺏기지 않아. 저건 내 거야..!'
늑대인간이 공존하는 세상. 늑인 우두머리의 외동딸 한지우의 앞에 <국민아들>, 배우 천유승이 나타난다.
그런데... 대체 뭐하는 놈이지? 왜 평범한 연예인이 늑대의 힘을 강하게 하는 거야?",https://shared-comic.pstatic.net/thumb/webtoon/835925/thumbnail/thumbnail_IMAG21_cc43c0d3-5ad4-44dd-85a1-94c925899f67.jpg,
https://comic.naver.com/webtoon/list?titleId=836042,별의 눈동자,백원달,금,"드라마, 현대판타지, 감성적인, 눈물샘자극, 미래, 로맨스, sf, 인외존재, 감성드라마",34,6261,"천재 천문학자 '우주혁'이 죽었다. 15년 뒤 그의 부활 안드로이드 '류성우'가 만들어진다.
우주혁의 얼굴과 기억을 지닌 류성우는 우주혁의 아내 '류별'을 사랑하지만, 류별은 그저 로봇일 뿐인 그를 거부하는데...
남편을 잃은 트라우마로 피아노를 연주할 수 없게 된 피아니스트와, 생명을 잃은 채로 영원히 살아가는 안드로이드의 어긋난 러브스토리.",https://shared-comic.pstatic.net/thumb/webtoon/836042/thumbnail/thumbnail_IMAG21_e348f8b2-e076-4a40-88de-8039c41449de.jpg,
https://comic.naver.com/webtoon/list?titleId=836052,마흔 즈음에,서쿤스,목,"드라마, 2024 연재직행열차, 고자극드라마, 리얼로맨스, 공감, 평범남, 연애/결혼공감, 개그, 하이퍼리얼리즘",34,129580,"어느 덧 마흔살이 된 현성민은 주변을 돌아보니 혼자가 되었다는 현실을 절실히 깨닫게 된다.
자신의 인생 뿐 아니라 직장에서도 위기를 맞게 된 현성민은 진정한 행복을 찾기 위해 고군분투 하기로 결심한다.

불혹의 나이, 아직 늦지 않았다!",https://shared-comic.pstatic.net/thumb/webtoon/836052/thumbnail/thumbnail_IMAG21_b475b1ef-5d2a-4afe-a1b4-5b3c6cc577f7.jpg,
https://comic.naver.com/webtoon/list?titleId=836253,캠퍼스의 로망,이쨍쨍,일,"드라마, 캠퍼스, 햇살남, 로맨스, 스릴러, 복수극, 걸크러시",34,10828,"'누나, 좋아해요'
학생회 비리와 각종 더러운 소문의 걔, 이지희가 복학했다.
소문과 달리 따뜻한 지희를 좋아하는 연산홍은 그녀에게 고백한다.
그런데 그날부터 학생회를 중심으로 한 이상한 소문과 사건들이 일어나기 시작한다.
아니, 사실이 밝혀진다고 해야 하나?",https://shared-comic.pstatic.net/thumb/webtoon/836253/thumbnail/thumbnail_IMAG21_b9b5fcae-16dc-4bf0-905d-31b1ea879029.jpg,
https://comic.naver.com/webtoon/list?titleId=836352,퇴출행성 세레나데,명명이,금,"로맨스, 2024 지상최대공모전, 연예계로맨스, 감성적인, 치명적인, 우정, 라이벌, 첫사랑, 혐관, 청춘, 공식미남, 헌신남, 짝사랑남, 사연남, 능력남, 재벌남, 순정남, 계략남, 집착남, 후회남, 나쁜남자, 평범녀, 순진녀, 사연녀, 아이돌, 후회물, 짝사랑, 아이돌연애, 혐관로맨스, 하이틴, 직진남, 재회, 연예계",29,32321,"탑 아이돌 ‘권재성’은 돌연 기량 황금기에 휴식을 취하기 위해 고향으로 돌아오고, 그곳에는 어릴 적 헤어진 권재성의 소꿉친구 ‘이수아’가 어른이 되기 위한 준비를 하고 있다. 좋게 이별하지 못했던 권재성은 성인이 되어 각자의 길로 향하기 전, 이수아에게 다시금 자신의 존재를 각인시키고자 한다.",https://shared-comic.pstatic.net/thumb/webtoon/836352/thumbnail/thumbnail_IMAG21_5aaa5450-7107-4a0a-8911-c787f3fdf715.jpg,
https://comic.naver.com/webtoon/list?titleId=836353,존 웹스터 도난 사건,"김본부, 한톨",금,"드라마, 우정, 가족, 음악, 학원물, 성장드라마, 감성드라마",26,3361,"하나예술고등학교에 다니는 18살 예지는 한국에서 열리는 세계 최고의 클래식 국제 콩쿠르에서 바이올린으로 우승하고 싶다. 1년 전에 죽은 언니 예서의 꿈을 대신 이뤄주고 싶어서다. 예지는 언니가 DK음악재단을 통해 대여받았던 고가의 바이올린 “존 웹스터”로 연습을 거듭하지만, 예지의 엄마 수진은 연습을 위해 자학까지 서슴치 않는 예지와 갈등을 빚다가 결국 바이올린을 음악재단에 반납해 버린다. 웹스터가 없다면 콩쿠르도, 우승도 아무런 의미가 없다고 믿는 예지는 모든 걸 포기하려는 순간, 콩쿠르 본선 합격 문자를 받는다. 예지는 과연 존 웹스터를 되찾고 콩쿠르에서 우승할 수 있을까? 지금부터 존 웹스터를 되찾기 위한 예지의 도심 속 모험이 시작된다!",https://shared-comic.pstatic.net/thumb/webtoon/836353/thumbnail/thumbnail_IMAG21_95c3aafc-4fc0-41c6-addf-c3d7c16fa4fb.jpg,
https://comic.naver.com/webtoon/list?titleId=836370,냉동무사,"박만사, 토이, 서행해주십시오, 최용준",일,"액션, 현대판타지, 동양, 무협/사극, 판무, 복수극, 먼치킨",33,60939,"주인을 위해 적을 안고 절벽에 떨어진 고려무사 척류검
빙하 속에 900년 동안 얼어있다 현대시대에 깨어나는데...
현대시대에 깨어난 고려제일검의 복수극",https://shared-comic.pstatic.net/thumb/webtoon/836370/thumbnail/thumbnail_IMAG21_f1b284c7-382a-4efe-8af4-e215fddd4fa1.jpg,
https://comic.naver.com/webtoon/list?titleId=836382,첩자의 마교생활,"대은호, DALGON",수,"무협/사극, 액션, 먼치킨, 소설원작",37,32897,"마교에 잠입한 무림맹의 첩자, 장이서.
그에게 처음이자 마지막 임무가 하달됐다.

그것은… 망나니로 유명한 칠공자 마오를 소교주로 만들라는 것!
천재적인 무재를 지녔지만 체질의 한계를 지닌 장이서와 재능은 출중하지만 어딘가 나사 빠진 마오의 만남에서 시작되는 사건들…!

​장이서와 마오는 마교의 천하에서 일인지하 만인지상(一人之下 萬人之上)의 자리에 오를 수 있을 것인가.",https://shared-comic.pstatic.net/thumb/webtoon/836382/thumbnail/thumbnail_IMAG21_7500f227-9c39-457c-a276-b760dc68b74c.jpg,
https://comic.naver.com/webtoon/list?titleId=836426,두근두근 귀연시,동우,일,"드라마, 하렘, 오컬트판타지, 게임, 상태창, 사연녀, 성장드라마",30,76194,"반지하 월세방에서 게임 스트리머로서 생활을 이어가던 최도연.
자신에게 많은 도움을 준 고향 선배이자 방송 선배인 삭제형에게
한 게임 링크를 받게 되는데.
별생각 없이 [두근두근 귀연시] 를 다운로드한 도연의 앞에
보여선 안될 그녀들이 보이기 시작한다.
당황도 잠시 목숨을 건 처녀귀신 연애 시뮬레이션이 시작되는데..",https://shared-comic.pstatic.net/thumb/webtoon/836426/thumbnail/thumbnail_IMAG21_facc2854-8ce6-4fc4-a676-64c2630a880c.jpg,
https://comic.naver.com/webtoon/list?titleId=836568,흑역사가 역주행한다,"이에프, 쇼메",목,"로맨스, 인소감성, 인생역전, 다정남, 로맨스코미디, 회귀, 하이틴, 학원로맨스, 청춘로맨스, 친구>연인, 역하렘, 소설원작",33,56414,"""흑역사를 지우면 또 다른 흑역사가 생긴다?""
아무 이유도 계기도 없이 갑자기, 회귀했다.
그것도 인생에서 가장 어두웠던 시절, 매일이 흑역사였던 17세 고등학생 시절로.
'이번 생은 반드시 부자가 되겠어!' 다짐했지만,
과거의 흑역사를 지울수록 돈은 멀어지고 남자만 꼬이기 시작한다?!
""난 그냥 부자가 되고 싶었을 뿐인데 왜 자꾸 너희들이랑 엮이는 거야!""
10대 시절 겪은 흑역사로 인생이 꼬여가던 채봄의 흑역사 지우기 프로젝트!",https://shared-comic.pstatic.net/thumb/webtoon/836568/thumbnail/thumbnail_IMAG21_f9016750-4890-4bd5-ba1a-9aa0c58210dc.jpg,
https://comic.naver.com/webtoon/list?titleId=836632,우아한 오브리,"탄지, 누르, 김캐롤",일,"로맨스, 집착남, 무심녀, 재회, 로판, 까칠남, 소설원작",36,33448,"섬을 탈출한 노예, 오브리 샌달우드의 목표는 단 하나였다.
노예였던 과거를 숨기고 누가 봐도 완벽한 레이디가 되는 것.
하지만 고대하던 첫 파티에서 오브리는 생각지도 못했던 남자와 재회한다.
그녀를 섬에서 구해주었던 소년이자 그녀의 과거를 아는 유일한 남자,
호기심 가득한 눈빛의 칼러드 카르너스를.",https://shared-comic.pstatic.net/thumb/webtoon/836632/thumbnail/thumbnail_IMAG21_de44b297-9fd7-41a9-94ac-4466a9bb373d.jpg,
https://comic.naver.com/webtoon/list?titleId=836651,시체들의 전쟁,마요너구리,금,"판타지, 액션판타지, 열혈, 배틀, 소년물, 액션, 성장물, 소년왕도물",30,44747,"네크로맨서들이 자신만의 기사를 만들어 싸우는 이 시대 최고의 스포츠 '시체들의 전쟁'.
수많은 사람들이 열정과 꿈을 불태우며 싸우는 잔혹한 싸움 속, 최후의 승자는 누가 될 것인가.",https://shared-comic.pstatic.net/thumb/webtoon/836651/thumbnail/thumbnail_IMAG21_949324ab-566c-440d-8640-aeea0dba84c3.jpg,
https://comic.naver.com/webtoon/list?titleId=836657,주먹 쓰는 천재 마법사,"팀감자스콘, 김민우, 월천",일,"액션, 사이다, 액션판타지, 열혈, 중세, 마법, 모험, 격투기, 게임판타지, 빙의, 먼치킨, 소설원작",33,40828,"격투기 세계 챔피언 '김진호', 마법사 '제드 아라한'의 몸으로 깨어나다!
기사는 근거리, 마법사는 원거리.
불변의 법칙을 깨는 천재가 나타났다.",https://shared-comic.pstatic.net/thumb/webtoon/836657/thumbnail/thumbnail_IMAG21_241f4439-2dd9-4bdd-b036-d9238c55fba0.jpg,
https://comic.naver.com/webtoon/list?titleId=836683,"아티팩트 먹는 플레이어
휴재","벤티, 기인",금,"판타지, 사이다, 액션판타지, 게임판타지, 먼치킨, 소설원작",32,50902,"내가 강해지는 방법은 정말 간단했다.

그저, 먹는 것.
열심히 아티팩트를 먹으면 됐다.

회귀도 했으니 이제는 원없이 먹어치워볼까?",https://shared-comic.pstatic.net/thumb/webtoon/836683/thumbnail/thumbnail_IMAG21_fcf2e8ca-cac4-4fe5-a73e-7266f3f39605.jpg,
https://comic.naver.com/webtoon/list?titleId=836685,연기깡패,예도,수,"드라마, 2023 지상최대공모전, 개그",32,28836,"한물 간 조폭 전문 배우 '태성'은 우연한 계기로(?) 진짜 조폭 '문길'과 처지가 바뀌게 된다.
무서운 형님들이 가득한 이 현장은 대본 없음. 컷 없음. NG 없음! 이곳에선 실수 한 번이 목숨값이다.
태성은 진짜 조폭들 사이에서 살아남을 수 있을까?",https://shared-comic.pstatic.net/thumb/webtoon/836685/thumbnail/thumbnail_IMAG21_ebe8124d-b923-41c7-bb98-07065be36263.jpg,
https://comic.naver.com/webtoon/list?titleId=836707,"꿇어보세요, 대공님!","가천가, 콩삼, 재겸",금,"로맨스, 사이다, 명랑녀, 로맨틱코미디, 혐관로맨스, 선결혼후연애, 까칠남, 소설원작",30,44385,"누구나 열받게 하는 상사를 패버리고 싶은 충동에 시달리지만 실행하기는 어렵다.
게다가 그 상사가 전쟁 영웅, 게다가 대공이라면.
복무점검을 시도때도 없이 시전하는 커티스를 보며 클로이는 그저 이를 악물 뿐이었는데…
그런 그녀에게 다시없을 기회가 왔다.

타국의 귀족과 정략결혼하라는 국왕의 명령에
커티스가 옆에 있던 부관인 클로이를 연인으로 내세운 것이다.

이제 총은 클로이의 손에 있으니…
“일단, 꿇어보시죠. 대공 각하.”",https://shared-comic.pstatic.net/thumb/webtoon/836707/thumbnail/thumbnail_IMAG21_f37ba38f-8a2e-4342-89ea-48ce37a11055.jpg,
https://comic.naver.com/webtoon/list?titleId=836785,폐황후 마리아,"하브린, 과자, 강희자매",월,"드라마, 성장로판, 중세, 서양, 시대물, 결혼생활, 혐관, 왕족/귀족, 짝사랑남, 대형견남, 집착남, 나쁜남자, 판타지, 짐승남, 미친작화, 성장물, 집착물, 고자극로맨스, 혐관로맨스, 재회, 성장드라마, 걸크러시, 까칠남, 소설원작",27,46348,"""기다려, 이제부터는 내가 천벌을 내릴 테니까.""

제국의 황후로서, 황제의 아내로서 최선을 다해 살아 온 마리아.
하지만 그녀에게 돌아온 것은 남편과 친구의 처절한 배신 뿐이었고, 종국에는 사랑하는 이들의 죽음만을 지켜본다.
마리아는 그렇게 타인에게 철저히 이용당한 채, 결국에는 폐황후의 칭호를 얻으며 타국으로 끌려
간다.

하지만 그곳에서 만난 붉은 머리의 사내 '군터'는 마리아가 알고 있던 과거의 기억과는 다른 진실들을 떠오르게 하고,
마리아는 절망의 끝자락에서 다시 한번 살고 싶어진다. 그리고 살아서, 복수 하겠다는 생각에 심장이 뛴다.",https://shared-comic.pstatic.net/thumb/webtoon/836785/thumbnail/thumbnail_IMAG21_da917c41-1795-48c7-af94-27becac16cef.jpg,
https://comic.naver.com/webtoon/list?titleId=836812,회귀했는데 세상이 안 망함,"손병준, 넴가, 선우",월,"판타지, 현대판타지, 액션판타지, 판타지개그, 현대, 게임, 생존, 모험, 크리처, 고인물, 차원이동, 게임판타지, 회귀, 헌터물, 먼치킨, 소설원작",32,37139,"세상을 구원하기 위해 과거로 돌아왔다.
그런데.. 세상이 안 망한다.
도혁에게 남은 건 산더미처럼 쌓인 빚뿐.
“월급 줄 테니까 게임방송이나 도와줘!”
...그래서 시작한 게임방송이 너무 쉽다.
전직 용사의 게임 스트리머 데뷔물.",https://shared-comic.pstatic.net/thumb/webtoon/836812/thumbnail/thumbnail_IMAG21_59834709-68d1-4d1d-9865-6e5ab4453f1d.jpg,
https://comic.naver.com/webtoon/list?titleId=836832,3인분,사즈,수,"드라마, 고자극드라마, 자극적인, 계략남, 능력녀, 피카레스크, 계략녀, 인플루언서",31,30856,"자랑이자 전부였던 남자친구가 죽었다.
""사랑하는 여자친구에게 모든 재산을 주겠다.""는 유언을 남기고...
그런데 여자친구가 3명! '사랑하는 여자친구'는 이 중에 누구?
유산은 단 한 명에게만 상속된다!",https://shared-comic.pstatic.net/thumb/webtoon/836832/thumbnail/thumbnail_IMAG21_3be093c9-6923-4db5-bc27-b9f65fcfbd25.jpg,
https://comic.naver.com/webtoon/list?titleId=836833,통제구역관리부,탄광,월,"스릴러, 2024 지상최대공모전, 고자극스릴러, 자극적인, 크리처, 괴담",30,128756,"여기는 통제구역관리부,
관리해야 할 곳들이라곤 온통 이상한 변칙과 수칙이 가득한 공간들 뿐이다.
하지만 아무리 기이한 일이 벌어진다 해도 일은 해야 하는 법.
오늘 하루는 무사히 살아서 보낼 수 있을까?",https://shared-comic.pstatic.net/thumb/webtoon/836833/thumbnail/thumbnail_IMAG21_a975a707-5678-4cc2-ab05-986433b3e1f1.jpg,
https://comic.naver.com/webtoon/list?titleId=836848,44교시 생존수업,상C,화,"스릴러, 학원액션, 서바이벌, 서스펜스, 두뇌싸움",29,208990,"갑자기 세상에 ‘검은 원’이라 불리는 구멍들이 생겨나기 시작했다.
검은 원은 미스테리 그 자체. 생긴 원인도, 내부에 뭐가 있는 지도 밝힐 수 없었다. 그저 지금까지 검은 원에 빠진 후 돌아온 사람이 단 한 명도 없다는 걸 빼고.
어느 날 주인공 도윤의 학교에도 검은 원이 생겨났다. 검은 원은 점점 커져 학교를 집어삼켰고 도윤을 포함한 대부분의 학생들이 검은 원 속에 빠지고 만다.
과연 아이들은 출구를 찾아 검은 원에서 탈출할 수 있을까?",https://shared-comic.pstatic.net/thumb/webtoon/836848/thumbnail/thumbnail_IMAG21_91382c72-745a-4df6-9a76-97fecf014390.jpg,
https://comic.naver.com/webtoon/list?titleId=836908,너랑 걷는 개 좋아,누리아 산귀노,토,"로맨스, 설렘폭발, 대형견남, 나쁜남자, 명랑녀, 햇살녀, 로맨틱코미디, 해외작품, 동물",36,14859,"이별 후 주인공에게 찾아온 이웃집 남자 타일러.
주인공은 강아지를 잘 다루는 그를 보며 마음이 설레어 가는데..",https://shared-comic.pstatic.net/thumb/webtoon/836908/thumbnail/thumbnail_IMAG21_d1d105d5-9402-4123-bdb1-d1f0b0206751.jpg,
https://comic.naver.com/webtoon/list?titleId=836948,우리의 공백,조예빈,일,"로맨스, 감성적인, 학원물, 청춘로맨스, 재회, 구원서사",30,20881,"누군가 떠나는것이 두려워 회피형으로 자란 '희진'
자신과 정반대의 모습이 된 소꿉친구 '진환'과 5년만에 재회한다.
외톨이 희진이와 화려한 친구들의 조심스럽고 소중한 사랑과 우정이야기",https://shared-comic.pstatic.net/thumb/webtoon/836948/thumbnail/thumbnail_IMAG21_c0a3952d-ac95-4b0b-a75c-a6ed72a86ed8.jpg,
https://comic.naver.com/webtoon/list?titleId=836950,껍데기,도노,목,"스릴러, 고자극스릴러, 절망적인, 현대, 학원물",30,43658,"따돌림과 외모 콤플렉스에 짓눌린 소심한 여고생 박다솜.
어느 날, 동경하던 완벽한 소녀 채이슬의 '껍데기'를 발견하고 홀린 듯 그 속으로 들어간다.
이슬의 눈부신 삶에 도취된 것도 잠시, 곧 이 집안의 끔찍한 진실과 마주한다.
과연 이슬은 어디에 있으며, 이 껍데기의 정체는 무엇일까?",https://shared-comic.pstatic.net/thumb/webtoon/836950/thumbnail/thumbnail_IMAG21_6aa2a2d3-a9c2-4a24-9483-e8b64d50e5ca.jpg,
https://comic.naver.com/webtoon/list?titleId=837022,전생혈마,"장작가, 산천",목,"판타지, 액션판타지, 환생, 액션, 성장물, 헌터물, 성장드라마, 소설원작",30,13580,"재능도, 능력도, 스킬도 없는 하위 1% 탱커 강산. 불행 그 자체인 그의 앞에 신의 사자가 나타난다.
“당신은 전생에 혈마였습니다.”
전생의 업보를 해소하기 위해 혹독한 시련을 감당해야 한다.
하지만 그 대가로 막대한 보상이 주어진다고?
“좋아. 원하는 대로 다 해주지.”
나약한 F급 탱커, 피로 물든 운명을 바꿀 수 있을까?",https://shared-comic.pstatic.net/thumb/webtoon/837022/thumbnail/thumbnail_IMAG21_059c431d-e789-41b6-8a90-7e9d961fc9ae.jpg,
https://comic.naver.com/webtoon/list?titleId=837100,별과 사슬이 뜨는 섬,"어패류메기, 훌리",수,"판타지, 액션판타지, 학원액션, 배틀, 소년물, 성장물, 이능력배틀물, 소년왕도물",32,30377,"헌터의 꿈을 가졌지만 재능은 없는 만년 지망생 ‘기승현’. 그런 그의 앞에 12년간 혼수상태에 빠져있던 누나 ‘기소현’이 깨어나게 된다. 누나의 기상과 함께, 정체되어 있던 운명의 수레바퀴가 돌아가기 시작한다.",https://shared-comic.pstatic.net/thumb/webtoon/837100/thumbnail/thumbnail_IMAG21_4b24b4cd-9477-47e5-a7b7-dad16f88fb2d.jpg,
https://comic.naver.com/webtoon/list?titleId=837101,우리집에 온 여우들,김현,토,"로맨스, 러브코미디, 감성적인, 설렘폭발, 우정, 가족, 첫사랑, 청춘, 중년, 사연남, 햇살남, 능글남, 계략남, 얼빠녀, 짝사랑녀, 평범녀, 로맨틱코미디, 일상, 인소감성, 하이틴, 학원로맨스",26,42561,"17살 인정의 엄마인 상정은 연매출 수십억의 맛집 사장.
돈길만 걷던 모녀 앞에 어느 날 남 다른 포스의 미중년 아저씨가 찾아온다.
그의 이름은 여병희. 아주 오래전 엄마인 상정의 짝사랑 상대였는데...
여태 어디서 뭘 하며 구르다가, 홀몸인 된 상정이 맛집 사장으로 이름을 날리자 나타난 것이다!
인정과 동갑인 17살 존잘 아들래미 여우진을 데리고.",https://shared-comic.pstatic.net/thumb/webtoon/837101/thumbnail/thumbnail_IMAG21_fb077599-c824-4fff-b455-b51bd60b6ee0.jpg,
https://comic.naver.com/webtoon/list?titleId=837139,공정거래위원회,"권오준, taibogi, 현우",일,"일상, 사이다, 현대판타지, 오피스, 정치, 자본주의, 환생, 드라마, 두뇌싸움, 소설원작",36,24516,"하청업자는 내게 고마운 로봇들일 뿐이었다.
그 로봇들을 쥐어짜는 건 너무나도 당연한 일.
그러나 몸담았던 그룹에서 토사구팽을 당한 나는
새로운 몸에서 눈을 뜨고서야 '로봇'들의 눈물을 보았다.
죽음의 문턱에서 얻은 두 번째 삶, 내 영혼은 구원받을 수 있을까?",https://shared-comic.pstatic.net/thumb/webtoon/837139/thumbnail/thumbnail_IMAG21_970862a3-ae94-4477-b60d-7fe21c374d40.jpg,
https://comic.naver.com/webtoon/list?titleId=837140,당신의 외도,나나은,금,"드라마, 고자극드라마, 자극적인, 결혼생활, 가족, 중년, 서스펜스",31,28759,"부유하고 화목한 가정에서 자란 한민서.
어느 날, 친구들과 들른 음식점 맞은 편 모텔에서 부모님의 차가 나오는 것을 목격하게된다.
하지만 민서는 부모님 중 누가 그 차를 운전했는지 모른다.

단순한 오해일까, 아니면 정말 외도일까?
믿고 싶지 않은 진실 속에서, 민서는 끝까지 자신을 지키고 진실을 마주할 수 있을까?",https://shared-comic.pstatic.net/thumb/webtoon/837140/thumbnail/thumbnail_IMAG21_1eed71eb-7480-4a4d-98ff-54ccda83b62a.jpg,
https://comic.naver.com/webtoon/list?titleId=837308,Dog한 로맨스,"보현, 문써니",월,"로맨스, 러브코미디, 가족, 능력녀, 로맨틱코미디, 드라마, 동물",30,10342,"'내 자식과도 같은 반려견이 알고 보니 재벌가의 상속견이라고?'

버려진 장군이를 입양한 지 어언 1년.
근데 이 기특한 놈이 글쎄, 외로웠던 도훈에게 가족이 되어준 것에 모자라 '이채영'이라는 운명 같은 사랑까지 물어다 주었다.
그러나 채영은 절대 호락호락한 상대가 아니었다.
사랑이 시작될 무렵, 느닷없이 나타나 장군이를 데려가겠다는 재벌 2세.
그리고 밝혀지는 장군이의 놀라운 비밀.

과연 도훈은 사랑도 가족도 모두 지켜낼 수 있을 것인가.",https://shared-comic.pstatic.net/thumb/webtoon/837308/thumbnail/thumbnail_IMAG21_f6d1df8d-ab2b-49a2-a422-7f09e7a44047.jpg,
https://comic.naver.com/webtoon/list?titleId=837336,"비밀복식클럽
휴재",소영,토,"드라마, 일상개그힐링, 감성적인, 설렘폭발, 공감, 미래, 우정, 청춘, 명랑녀, 햇살녀, 감성, 일상, 성장물, 무해한, 햇살캐, 러블리, 동아리",,16866,"인류가 초래한 위기로 40%만 생존한 2054년, 전지구인은 환경이 절대 우선인 ‘재생 인류시대’에 합의한다.
반세기 뒤, 생필품을 뺀 패션을 비롯한 모든 개성 추구가 금지를 넘어 죄악인 사회에서 각각의 이유로 패션을 하고 싶어 하는
무모한 다섯 중학생들이 모여 '비밀 복식 클럽을 결성하는데...! 용맹 중학생들의 우당탕 패션사!",https://shared-comic.pstatic.net/thumb/webtoon/837336/thumbnail/thumbnail_IMAG21_c67e65f9-0703-4649-9ff0-454307d98313.jpg,
https://comic.naver.com/webtoon/list?titleId=837417,요괴삼월,이윤희,일,"판타지, 순진남, 러브코미디, 동양풍로맨스, 현대판타지, 현대, 로맨틱코미디",28,14505,"전 태권도 국가대표 선수 이은비. 슬럼프에 빠져 운동을 그만두고 그런대로 살아가던 어느 날, 정체불명의 검은 강아지를 줍게 된다. 그런데… 그 강아지가 사람이 됐다?! 그 귀랑 꼬리는 뭔데!!! 기억을 잃은 강아지(?) 삼월이와 전투력 999 은비의 판타지 요괴요괴 동거 라이프!",https://shared-comic.pstatic.net/thumb/webtoon/837417/thumbnail/thumbnail_IMAG21_53bc386b-83b3-48d2-9e5d-26a92c280d7e.jpg,
https://comic.naver.com/webtoon/list?titleId=837424,어느 날 갑자기 최애가 생겼다,맛스타,목,"로맨스, 연예계로맨스, 아이돌, 아이돌연애, 연예계",28,27775,"인기 정상의 여돌을 은퇴하고 이제 배우로 전향한 30살의 ‘하시연’
어느 날 갑자기 중소기업 남돌 ‘한은결’에게 덕통사고를 당하는데,
늘 사랑받는 게 익숙했던 그녀에게 최애가 생겼다!
과연 끝까지 자신의 정체를 들키지 않고 덕질할 수 있을까?
두근두근 비밀스런 아이돌 덕질 로맨스!",https://shared-comic.pstatic.net/thumb/webtoon/837424/thumbnail/thumbnail_IMAG21_bccc255a-dbba-4025-90d8-b574b5006d7f.jpg,
