url,title,authors,weekday,tags,total_episodes,likes,synopsis,thumbnail_url,error
https://comic.naver.com/webtoon/list?titleId=814587,펜홀더,이은재,금,"스포츠, 열혈, 우정, 라이벌, 청춘, 성장물, 학원물, 성장드라마, 소년왕도물, 스포츠성장",94,115750,"천재적인 재능으로 모든 스포츠를 씹어먹는 고등학생 한이연.
어떤 스포츠를 해도 패배를 몰랐던 그에게, 벽을 느끼게 해준 한 탁구 고수가 등장하는데...
승부욕에 불타오른 이연은 사라져가는 '펜홀더' 라켓으로 복수를 꿈꾼다!",https://shared-comic.pstatic.net/thumb/webtoon/814587/thumbnail/thumbnail_IMAG21_4d3bb97b-a0ca-4d51-8e2b-8d2ca83cce53.jpg,
https://comic.naver.com/webtoon/list?titleId=814595,너에게로 중독,"무멘, 태양, 안테",토,"로맨스, 이능력, 공식미남, 집착남, 공식미녀, 미스터리, 사연녀, 세계관, 재회, 로판, 소설원작",85,110552,"가로등 불빛이 꺼지던 밤, 어둠에 스며든 낮은 목소리가 들려온다.

“저기요.” 고개를 돌린 세아의 시야를 맹렬히 긁으며 나타난 남자의 얼굴. 10년 전, 죽은 줄로만 알았던 사랑하는 남자가 살아 돌아왔다. 안겨오는 거대한 몸, 남자로 변한 체향.

“누나 집에 들여 보내줘.”

자신을 찾아온 열다섯 소년이 아닌 스물다섯 살의 도현과 만나게 된 세아는 떨어져 있던 시간 동안 달라진 도현에게 숨겨진 비밀을 하나씩 알게 되는데…….",https://shared-comic.pstatic.net/thumb/webtoon/814595/thumbnail/thumbnail_IMAG21_ff4186af-bcff-4833-981e-40473a2fd827.jpg,
https://comic.naver.com/webtoon/list?titleId=814599,수인 보호소에서 남주를 입양해 버렸다,"유지별이, 설단희",수,"로맨스, 순진남, 성장로판, 악역이주인공, 가족, 왕족/귀족, 순정남, 악녀, 성장물, 러블리, 힐링, 인외존재, 빙의, 동물, 로판, 소설원작",89,129186,"피폐삽질 소설의 시에나 로베트라는 악녀에 빙의했다.

돌연변이라는 이유로 표범 가문에서 버려져 수인 보호소에 온 남주를 괴롭히다,
뒤늦게 아들을 찾아온 공작에 의해 단명하는 역.

어떻게든 살아보겠다고 팔불출 아빠를 설득해서
공작이 오기 전까지 이반을 보호하는 데는 성공했는데…….

막상 공작이 찾아오자 생각지도 못한 상황이 펼쳐진다.

“저 인간도 데려가지.”

에? 저요?

저는 아빠랑 여기서 살고 싶은데요?",https://shared-comic.pstatic.net/thumb/webtoon/814599/thumbnail/thumbnail_IMAG21_945a39a9-b0a2-49e8-a9f4-2207969c1572.jpg,
https://comic.naver.com/webtoon/list?titleId=814742,좀비묵시록 82-08,"달아, 아쿠아콘, 경우, 박스오피스",월,"액션, 자극적인, 시리어스, 절망적인, 현대, 스릴러, 아포칼립스, 밀리터리, 서스펜스, 감염, 소설원작",92,84139,"탕-!

의문의 선박 속
'그것'으로부터 시작된 괴이한 전염병은
서울을 죽음의 도시로 만들어버린다.

예고 없이 닥쳐온 심판의 그날부터
세상의 모든 질서는 완전히 리셋되었다.

처절한 생존 경쟁 속에서
프로젝트명 [좀비묵시록 82-08]이 시작된다.",https://shared-comic.pstatic.net/thumb/webtoon/814742/thumbnail/thumbnail_IMAG21_78eadccd-67fa-4657-be55-365b69520a45.jpg,
https://comic.naver.com/webtoon/list?titleId=814781,미친 재능의 플레이어,"OMinute, 호라칸, 체나",월,"판타지, 레드아이스 스튜디오, 사이다, 게임, 상태창, 이능력, 크리처, 고인물, 게임판타지, 헌터물, 인외존재, 소설원작",89,97932,"세상의 운명이 걸린 게임이 시작되고 6년.
한 번도 톱 랭커의 자리를 내어주지 않은 최강의 플레이어,
영웅왕 강유성 역시 새로운 시즌을 맞이한다.

“저는…… X나 예전에 끝났습니다. 돈 때문에 하는 거죠.”
[도발 수치가 대폭 상승합니다!]
[어릿광대 군주가 계약자의 행동에 흡족함을 표시합니다!]

미친 재능의 플레이어가 살아남는 법이 펼쳐진다!",https://shared-comic.pstatic.net/thumb/webtoon/814781/thumbnail/thumbnail_IMAG21_eda09ada-fee2-418c-ad37-b9f430471242.jpg,
https://comic.naver.com/webtoon/list?titleId=814817,흑역사 어게인,안수민,화,"로맨스, 설렘폭발, 청춘, 순정남, 러블리, 다정남, 짝사랑, 타임슬립, 환골탈태, 회귀, 하이틴, 학원로맨스, 학원물, 청춘로맨스, 재회, 삼각관계, 복수극",105,82669,"운 제로, 인복 제로, 외톨이로 보냈던 고독하고 우울한 학창 시절.
흑역사 그 자체인 어린 시절을 극복하고 행복한 하루하루를 보내고 있는 스물여덟 유미.
모든 것이 완벽한 나날을 뒤로하고 가장 불행했던 과거로 타입슬립?!

미래에 두고 온 마지막 사랑과 과거의 잊고 있었던 첫사랑 사이에서의 갈등!",https://shared-comic.pstatic.net/thumb/webtoon/814817/thumbnail/thumbnail_IMAG21_495bd250-daae-4308-a615-9267801c2595.jpg,
https://comic.naver.com/webtoon/list?titleId=814820,상사불상사,"영하, 공사",일,"로맨스, 리얼로맨스, 설렘폭발, 오피스, 무심남, 대형견남, 능력녀, 로맨틱코미디, 가벼운, 요즘핫한추천작, 오피스로맨스, 삼각관계",85,188257,"갑의 말에는 절대복종!
5년차 K-직장인 하은호의 신념이다.

'빈틈없이 쌓아온 커리어만 있다면 연애는 안 해도 된다.'

그런 그녀 앞에 어느 날 뚝 떨어진 낙하산 신입?
다시 흔들기 시작하는 과거 첫사랑?
이 불상사를 어떻게 해야 해!
달콤살벌 오피스 로맨스 코미디!",https://shared-comic.pstatic.net/thumb/webtoon/814820/thumbnail/thumbnail_IMAG21_0a5722c7-129e-46ed-8104-3cc7445aa590.jpg,
https://comic.naver.com/webtoon/list?titleId=814830,신입은 낮져밤이,"다심, 고기감자, 블랑드",수,"로맨스, 낮져밤이, 폭스남, 로맨스코미디, 오피스로맨스, 사내연애, 소설원작",71,64731,"낮에는 천사같이 다정한 신입이, 밤만 되면 달라진다.
입사 3개월 차, 잘생기고 매너 좋은 신입이 알고 보니 회장님 아들이었다?
그런데 녀석이 속인 것이 신분만은 아니었다. 성격이...성격이 거지 같다!!
""좋은 아침이에요, 신이연 과장님.""
낮에는 세상 다정하고 싹싹한 신입이
""내일까지 처리해.""
밤만 되면 건방진 회장 아들의 모습을 드러낸다.
문제는 그걸... 나만 안다는 것.
알려지면 안된다며 계약서까지 작성한 마당에, 본격 아찔해진 회사 생활이 시작되었다.
신입을 남몰래 모시게 된 상황도 고통스럽지만, 낮이면 순둥이 연기를 펼치는 녀석의 모습을 지켜보는 건 더더욱 고통스럽기만 하다.
그런데...틱틱거리긴 하지만 힘들 때마다 어느샌가 도와주고 자꾸만 나를 유혹하는 듯한 신입에게 홀린듯이 빠져들고 있다.
저 얄미운 녀석을, 대체 어떻게 하면 좋지?",https://shared-comic.pstatic.net/thumb/webtoon/814830/thumbnail/thumbnail_IMAG21_1db59977-b727-4e6e-81da-8fb88c544ccc.jpg,
https://comic.naver.com/webtoon/list?titleId=814834,"체탐자
휴재","병장, 박만사, 겸자",화,"무협/사극, 소년왕도물",82,123419,"‘세종의 비밀병기, 그림자부대 체탐자.’
어린 시절부터 전쟁터를 헤매며 귀신의 그림자라 불리는 귀영.
복수를 다짐하며 이 나라 최초의 특수부대 체탐자의 일원이 되기로 한다.",https://shared-comic.pstatic.net/thumb/webtoon/814834/thumbnail/thumbnail_IMAG21_97e297d4-e9b6-47c4-946c-cd22cb3c0270.jpg,
https://comic.naver.com/webtoon/list?titleId=816614,나를 미워하던 남편이 기억을 잃었다,"카레만두, 액고, 시세Sisse",토,"로맨스, 결혼생활, 순정남, 집착남, 공식미녀, 소심녀, 철벽녀, 사연녀, 다정남, 집착물, 후회물, 직진남, 선결혼후연애, 로판, 소설원작",90,208655,"악명 높은 에버렛 공작가의 사생아 릴리 에버렛. 가문을 위해 팔려가듯 혼인하게 되고 상대는 다름 아닌 테오도르 발렌티노!
에버렛에 의해 모든 걸 잃은 남자와의 결혼 생활은 결코 순탄치 않았다.

‘…내가 사실은 반쪽짜리 사생아조차 아니라고 한다면, 당신은 어떤 표정을 지을까.’

그렇게 수많은 감정이 교차하기만 하던 어느 날,
그가 기억을 잃어버리고 마는데…?

“기억이 돌아오면 당신…후회할 거예요.”
“아니요, 조금도 후회하지 않을 겁니다.”",https://shared-comic.pstatic.net/thumb/webtoon/816614/thumbnail/thumbnail_IMAG21_a6c58ae0-f0d2-4345-801b-c8d164ab3db8.jpg,
https://comic.naver.com/webtoon/list?titleId=816798,킬러 배드로,"김정현, 임리나",토,"액션, 시리어스, 미친작화, 범죄, 고인물, 격투기, 학원물, 복수극, 먼치킨, 느와르",104,534748,"배신당한 노인킬러 회춘하다!
그런데... 아무도 날 못 알아봐?!
""그럼 내가 최강이지!""",https://shared-comic.pstatic.net/thumb/webtoon/816798/thumbnail/thumbnail_IMAG21_e2ec52f5-8822-4c23-a246-41f36d7c9a65.jpeg,
https://comic.naver.com/webtoon/list?titleId=816809,"별을 품은 소드마스터
휴재","홍대의, 주노, Q10",수,"판타지, 중세판타지액션, 시리어스, 서양, 소년물, 용사, 액션, 성장물, 소년왕도물, 소설원작",97,320709,"기사를 동경하는 슬럼가의 부랑아 블라드.
검은 벼락을 맞는 사고 이후부터 들리기 시작한 누군가의 목소리와,
어느 날 갑자기 등장한 푸른 달빛의 기사가 블라드의 세계를 산산조각내면서
뒷골목 소년의 삶이 송두리째 변하기 시작하는데...

높디높은 밤하늘에 있지 않더라도,
아무도 보지 못하는 곳에 떨어져 있더라도
스스로가 빛나기를 원한다면, 그렇다면 그것은
별일 것이다.",https://shared-comic.pstatic.net/thumb/webtoon/816809/thumbnail/thumbnail_IMAG21_55348686-22ee-49ed-ae07-ad9b39ec748f.jpg,
https://comic.naver.com/webtoon/list?titleId=816913,뼈왕,유성연,금,"판타지, 판타지개그, 중세, 서양, 이능력, 모험, 병맛, 가벼운, 개그, 차원이동, 4차원, 이세계",105,43578,"낯선 이세계에 떨어지게 된 정형외과 의사 이대환.
그는 뼈를 조립하여 해골을 되살릴 수 있는 능력을 발견한다.
그렇게 살려낸 수많은 해골들의 지지 속에 뼈왕으로 등극!
하지만 행복도 잠시. 전투 중에 생명과도 같은 오른팔을 잃게 되고, 오른팔을 되찾기 위해 여행길에 오르게 되는데...",https://shared-comic.pstatic.net/thumb/webtoon/816913/thumbnail/thumbnail_IMAG21_5cdd430d-02b5-4d29-b048-9c046e6ffda4.jpg,
https://comic.naver.com/webtoon/list?titleId=817019,날 먹는 건 금지양!,조9,월,"로맨스, 청춘, 공식미남, 명랑녀, 러블리, 힐링, 학원로맨스, 청춘로맨스, 친구>연인, 인외존재, 까칠남",101,79501,"잘생겼지만 성격이 개(?) 같기로 유명한 '남해술'은 소꿉친구인 '양미루'에게만 잘해준다.
좋아해서 잘해주는 게 분명해! 정말 그런 걸까?
해술이의 속마음을 전혀 모르겠는 미루.
그러던 어느 날, 미루는 해술이가 품고있는 ''흑심'에 대해 알게 되는데!
10년 우정에 금이 가기 시작한다..!
늑대소년과 순둥이 소녀의 천방지축 성장기!",https://shared-comic.pstatic.net/thumb/webtoon/817019/thumbnail/thumbnail_IMAG21_22cf1c1b-376e-40ee-b643-a48db411247a.jpg,
https://comic.naver.com/webtoon/list?titleId=817032,열렙전사 3부,"김세훈, 스튜디오 호호이",금,"액션, 열혈, 게임, 소년물, 모험, 성장물, 고인물, 게임판타지, 먼치킨",108,123973,"이번엔 현실이다!
게임이 되어버린 세상, 열렙전사 공원호가 다시 한 번 최강의 자리를 노린다!",https://shared-comic.pstatic.net/thumb/webtoon/817032/thumbnail/thumbnail_IMAG21_75d7192e-5de2-46ae-bd94-749477fbabe6.jpg,
https://comic.naver.com/webtoon/list?titleId=817177,괴물 의상실,스페트,금,"드라마, 크리처, 판타지, 2022 최강자전, 성장물, 무해한, 최강자전, 힐링, 직업드라마, 이세계, 인외존재, 성장드라마, 감성드라마",79,53089,"패션 디자이너의 꿈을 포기하던 그날, 낯선 세계에 떨어진 윤비단은 우연한 기회로 수상한 의상실에서 일하게 된다.
그곳은 바로 괴물이 인간 사이에 섞여 살아갈 수 있도록 특수한 옷만을 제작하는 괴물 맞춤 의상실 ‘루델리’.
윤비단은 그곳에서 수많은 괴물들을 만나며 옷을 디자인하게 되는데..

과연 꿈을 되찾고 어엿한 디자이너가 될 수 있을까?",https://shared-comic.pstatic.net/thumb/webtoon/817177/thumbnail/thumbnail_IMAG21_6c3cb214-da58-423b-8cd8-e652bb60708b.jpg,
https://comic.naver.com/webtoon/list?titleId=817246,할배무사와 지존 손녀,"신의철, 김명현, 일향(一向)",목,"무협/사극, 정통무협, 모험, 가족, 액션, 성장물, 고인물, 육아물, 먼치킨, 소설원작",100,139661,"죽을 날을 앞두고 미련없이 생을 마무리 하려던 순간 덮친 멸문지화!
유진산은 홀로 생존한 갓난 손녀 '유설'이 다 자랄 때까지만이라도 살아남기로 결심한다.
이미 늙어버린 몸으로 육아와 수련을 병행하며 눈물겨운 사투를 벌이는 동안,
어느새 무림지존의 기재를 타고난 손녀는 믿을 수 없이 빠르게 성장해가고 있었다.
""걱정마, 할배. 이젠 내가 지켜줄게!""",https://shared-comic.pstatic.net/thumb/webtoon/817246/thumbnail/thumbnail_IMAG21_0cca8109-c5c2-4a25-91b3-0b338a73e59d.jpg,
https://comic.naver.com/webtoon/list?titleId=817247,못 잡아먹어서 안달,"팀 보도뵈, 퀀퀀, 플아다",화,"로맨스, 자극적인, 할리퀸, 혐관, 사연남, 능력남, 재벌남, 나쁜남자, 다정녀, 참교육, 사연녀, 재벌, 고자극로맨스, 복수극, 소설원작",103,349382,"출중한 능력. 어딜 내놓아도 꿀리지 않을 외모. 번듯한 집안.
잘 닦인 길만을 걸으며 살았다. 지루할 정도로 모든 게 완벽했다.
그랬던 서른 살 어느 날… 김태준은 충동적으로 길을 벗어난다.
부모님의 목숨을 앗아간 운전 기사의 딸, '한소은'을 만나기 위해서.
'대체 무슨 낯짝으로 이 회사에 기어들어 온 거지?'
뻔뻔한 낯짝이 가증스러웠다. 그래서 곁에 두고 괴롭히기로 했다.
마치 못 잡아먹어서 안달이 난 사람처럼….
""저 이사님 좋아하는 것 같아요.""
어, 이게 아닌데?",https://shared-comic.pstatic.net/thumb/webtoon/817247/thumbnail/thumbnail_IMAG21_cbb48bd3-1c5b-4169-83d5-0ebe82c12921.jpg,
https://comic.naver.com/webtoon/list?titleId=817365,악당 가족이 독립을 반대한다,"밋츄, 하티, 이흰",월,"로맨스, 악역이주인공, 왕족/귀족, 공식미녀, 햇살녀, 로맨틱코미디, 악녀, 가벼운, 무해한, 햇살캐, 러블리, 다정남, 궁중로맨스, 역하렘, 빙의, 로판, 소설원작",77,161534,"가족애 따위 없는 살벌한 악당 가문의 사생아 엘로디, 어느 날 갑자기 전생의 기억을 찾다!
자신이 환생한 이곳이 전생에 읽었던 소설 속이며
3년 후 진짜 여주인공이 나타나면서 자신은 악당 가족에게 버림받고 살해당할 운명임을 깨닫고
언니가 등장하기 전까지 적당히 뒷돈 챙기다가 이 가문에서 독립하자!고 생각했는데……
“독립? 그게 무슨 개소리지?”
“너한테 바람 불어 넣은 놈이 누구야.”
“누님, 혹시라도 가출할 생각은 아니겠지?”
가족들이 독립을 반대한다? 저 살고 싶은데요, 독립시켜 주세요!",https://shared-comic.pstatic.net/thumb/webtoon/817365/thumbnail/thumbnail_IMAG21_f60d4626-86f6-4ed4-aad0-6bd806f91043.jpg,
https://comic.naver.com/webtoon/list?titleId=817366,"내 남편의 정부에게
휴재","에리카, 댄싱브레인, 라치크",화,"로맨스, 자극적인, 유혹남, 능글남, 폭스남, 환골탈태, 고자극로맨스, 복수극, 로판, 소설원작",89,164781,"나, 레티시아 비올렛은 남편에게 헌신했지만, 모든 것을 잃었다.
그대로 목숨까지 잃을 뻔하던 찰나, 한 남자가 나타난다.
그 남자는 완벽한 복수를 이루도록 도와준다는데...
""제 복수를 이루어 주겠다는 말... 꼭 지켜 주세요.""
날 죽음까지 몰아넣은 그들에게, 내가 받았던 모든 걸 되돌려주리라.",https://shared-comic.pstatic.net/thumb/webtoon/817366/thumbnail/thumbnail_IMAG21_358d6676-51bf-4a54-b4ff-b55edf907efe.jpg,
https://comic.naver.com/webtoon/list?titleId=817369,히든클래스 중력자로 최강을 노린다,"네코코, 치쿠와",목,"판타지, 현대판타지, 현대, 소년물, 성장물, 해외작품, 고인물, 회귀, 헌터물, 인외존재, 먼치킨",106,56886,"일본 네이버 웹툰(라인망가) 소년/판타지 부문 TOP10!
""S급 헌터인 나였기에 중력자야말로 최강 클래스라는 걸 알고 있다.""
몬스터가 습격해 오는 현대 사회. 도적 클래스를 보유하고 있던 이코마는 능력 제한으로 인해 남들보다 뒤처지게 되었다.
하지만 흉악한 드래곤으로부터 레어 아이템을 훔쳐 과거로 돌아가는 데에 성공한다.
""이번에야말로...최강 헌터가 되어 주겠어!"" 역사를 바꾸는 새로운 영웅의 활약이 지금 시작된다!",https://shared-comic.pstatic.net/thumb/webtoon/817369/thumbnail/thumbnail_IMAG21_be76f4ba-d928-4c3b-a91f-f4ab8e82af3e.jpg,
https://comic.naver.com/webtoon/list?titleId=817631,학생만 하면 안 될까요?,"글비, 나우",목,"판타지, 오컬트판타지, 소년물, 성장물, 세계관, 최강자전, 오컬트, 이능력배틀물, 인외존재",69,55869,"평범한 학생으로 살고 싶은 소년 고풍림.
그는 감정을 먹고 태어나는 '업귀'를 퇴마하며
누구보다도 피곤한 삶을 살고 있는데....

아니, 됐다고요! 저는 그냥, 제발, 평범하게...
학생만 하면 안 될까요?",https://shared-comic.pstatic.net/thumb/webtoon/817631/thumbnail/thumbnail_IMAG21_cd2b2358-d01c-45d7-be03-bcc6b5d47c42.jpg,
https://comic.naver.com/webtoon/list?titleId=817635,센스제로,구리,금,"로맨스, 순진녀, 로맨틱코미디, 가벼운, 햇살캐, 짝사랑, 4차원, 친구>연인, 삼각관계, 공감성수치",87,88071,"매사에 너무 너무 긍정적이라서 일까? 눈치가 없어도 너무 없는 윤지호.
그런 그녀를 오랫동안 남몰래 짝사랑해온 남자들이 있다.
과연 그들의 마음이 최악의 센스제로 윤지호에게 닿을 수 있을까?
이 시대 최고의 넌씨눈 코미디 로맨스.",https://shared-comic.pstatic.net/thumb/webtoon/817635/thumbnail/thumbnail_IMAG21_9ccac109-d90f-434e-b2e2-e45cd12e2689.jpg,
https://comic.naver.com/webtoon/list?titleId=817752,새동네,림스,금,"스릴러, 고자극스릴러, 액션, 참교육, 범죄, 힘숨찐, 서스펜스, 느와르",92,54779,"오갈 데 없는 노인들이 산간벽지를 개간해 작은 마을 공동체를 이루며 살기 시작하였으니, 이름하여 새동네! 어느 날, 새동네 일대가 신도시 재개발에 휩싸이고 부정한 세력들이 들어오자 마을의 평화와 존립을 위해 결국 노인들이 나서며 경고하는데…... “잠 자는 사자의 코털은 건드는 게 아녀~!”",https://shared-comic.pstatic.net/thumb/webtoon/817752/thumbnail/thumbnail_IMAG21_48c1011d-58ce-415f-b012-1a7bb020a5a3.jpg,
https://comic.naver.com/webtoon/list?titleId=817945,어린이집 다니는 구나,구나,월,"일상, 공감, 무해한, 러블리, 힐링, 직업드라마, 육아물, 하이퍼리얼리즘",170,116995,"""노는 게 제일 좋아!"" 라고 했더니 정말 노는 게 직업이 됐다?! 매일 동심의 세계로 출퇴근한지 어쩌다 10년째!
아이들이라면 알 만큼 안다고 생각했는데... 예측불가한 말과 행동들은 여전히 새롭기만 하다.
그런 아이들에게 언제나 ""그랬구나"" 라고 말해주는,
10년차 프로공감러 구나가 들려주는 어린이집 선생님 이야기",https://shared-comic.pstatic.net/thumb/webtoon/817945/thumbnail/thumbnail_IMAG21_c90a6d9e-3df5-41c4-b11a-7c6e61a89174.jpg,
https://comic.naver.com/webtoon/list?titleId=817958,왕의 힘으로 회귀한다,"재키레이, KIM, 안소설",토,"판타지, 레드아이스 스튜디오, 액션판타지, 상태창, 이능력, 배틀, 미친작화, 던전물, 회귀, 헌터물, 이능력배틀물, 먼치킨, 소설원작",105,169318,"무시, 멸시, 괴롭힘이 당연한 비각성자의 삶.

빌어먹을 루저...
빌어먹을 인생...
빌어먹을 각성..!

그리고 빌어먹을 죽음의 순간,
나는 기이한 존재 '왕'을 만난다.

눈 부신 빛과 함께 다시 시작된 또 한 번의 삶.
하지만 이번에는 다르다.
이제 나도 각성자니깐!

내 앞길을 방해하는 모두를 집어삼키고
다시는 누군가에게 고개 숙이는 삶을 살지 않을 거다.",https://shared-comic.pstatic.net/thumb/webtoon/817958/thumbnail/thumbnail_IMAG21_542523dc-b304-4a0b-9078-0b780c9b05d2.jpg,
https://comic.naver.com/webtoon/list?titleId=818192,염라강림,바른꽃,화,"판타지, 동양, 신화, 액션, 지금추천작, 오컬트, 동양풍판타지, 인외존재, 먼치킨",99,158037,"지옥이 망했다.
피가 흘러야 할 황천에는 맑은 물이 흐르고 망자들을 끓이던 솥은 차갑게 식은지 오래다.

은퇴한 염라대왕은 자신의 행복을 위해 윤회의 길을 택하고자 하지만,
혼란스러워진 지옥과 사라진 자신의 후임 털보로 인해 윤회의 길을 걸을 수 없게 된다.

인간 세상의 신이 되기 위하여 인간계와 지옥을 혼돈에 빠트린 채 사라진 털보를
쫓아 염라는 인간계에 강림하지만, 인간계는 털보의 수작으로 인해 지옥에서 도망친 망자들이 세상을 혼란케 하고 있었다.

염라는 지옥명부의 힘을 빌려 인간을 지키는 ‘장의사’들과 힘을 합쳐 털보를 잡아
세상을 원래대로 돌려놓기 위해 고군분투한다.

과연 염라는 무사히 윤회의 길을 걸을 수 있을까?",https://shared-comic.pstatic.net/thumb/webtoon/818192/thumbnail/thumbnail_IMAG21_070352b1-774b-4a15-80fa-7b5819fa4169.jpg,
https://comic.naver.com/webtoon/list?titleId=818205,빛나는 나나나나,마라링,화,"로맨스, 현대, 혐관, 무심남, 소심녀, 순진녀, 혐관로맨스, 학원로맨스, 까칠남",63,168243,"왕따를 당한 후 게임중독 은둔형 외톨이로 살고 있던 빛나는 게임에서 만난 찬이를 통해 용기를 얻는다.
변장을 하면 밖에 나갈 수 있지 않을까?
그리고 처음으로 변장을 하고 나갔던 날, 괴롭혔던 여자애까지 못알아보는데..?!
그 후 가발, 렌즈, 화장, 자세와 목소리 톤까지, 달라진 모습으로 변장을 하고 다시 학교에 갈 결심을 하는 빛나! 이 모습이라면 자신 있어!
그런데 쉐어하우스에서 같이 살게 된 남자애는 나한테 너무 쌀쌀맞아!
근데.. 저 남자애가 설마..? 과연 빛나는 이중생활을 들키지 않을 수 있을까?",https://shared-comic.pstatic.net/thumb/webtoon/818205/thumbnail/thumbnail_IMAG21_073553b6-435d-4897-885d-a316d1bbacb3.jpg,
https://comic.naver.com/webtoon/list?titleId=818255,무원야담,호우,화,"판타지, 오컬트판타지, 과거, 동양, 시대물, 모험, 오컬트, 인외존재",79,52839,"귀신을 부릴 수 있는 체질인 김위신은 복수를 위해 한 귀신을 쫓고 있다.
단서라고는 눈이 금색이라는 것뿐.
그 귀신의 행방을 알 수 있는 결정적인 실마리를 손에 넣기 직전,
귀신 쫓는 경귀석을 가진 박이로에 의해 5년의 노력이 한순간에 허사가 되고
그간 모았던 귀신과 귀물까지 모조리 날려버린다!
거기에 산군의 딸인 동백까지 합세해 복수는커녕 방해되는 짐만 줄줄이 딸리고,
열받은 위신은 전부 도깨비시장에 내다 팔 생각으로 여행길에 오르는데...

귀신에게 원망보다 강한 미련은 없다.
김위신 일행의 죽거나, 혹은 살거나! 귀신 쫓는 극한 퇴마 판타지!",https://shared-comic.pstatic.net/thumb/webtoon/818255/thumbnail/thumbnail_IMAG21_441a0a01-cf29-49c3-927a-2665f1dd7607.jpg,
https://comic.naver.com/webtoon/list?titleId=818401,"소곤소곤2
휴재",옛사람,금,"드라마, 감성적인, 시리어스, 옴니버스, 스릴러, 오컬트, 괴담, 감성드라마",74,39835,옛사람 작가의 옴니버스 미스터리 드라마 <소곤소곤>이 돌아왔다! 세상 어딘가에 있을 기묘한 이야기.,https://shared-comic.pstatic.net/thumb/webtoon/818401/thumbnail/thumbnail_IMAG21_bdc92b1a-6a86-4516-9a40-acaf13dfc324.jpg,
